[
  {
    "schema_version": 1,
    "Building.Code": "B-001",
    "Building.Description": "Main Office",
    "CellPhone": "+49-171-5551234",
    "DateOfBirth": "1985-04-12",
    "DateOfHire": "2010-09-01",
    "DateOfTermination": null,
    "Department.Code": "DEP10",
    "Department.Description": "Engineering",
    "Division.Code": "DIV-A",
    "Division.Description": "Product Development",
    "DriverLicenseClass": "B",
    "DriverLicenseNumber": "DLN1234567",
    "DriverLicenseState.Code": "BY",
    "DriverLicenseState.Description": "Bayern",
    "Email": "employee@example.com",
    "EmergencyContact": "Anna Musterfrau",
    "EmergencyHomePhone": "+49-89-123456",
    "EmergencyRelation": "Spouse",
    "EmergencyWorkPhone": "+49-89-987654",
    "EmployeeNumber": "EMP-1001",
    "EmployeeType.Code": "FULL",
    "EmployeeType.Description": "Full-time",
    "EthnicGroup.Code": "EG1",
    "EthnicGroup.Description": "Group 1",
    "FloorArea.Code": "FA-01",
    "FloorArea.Description": "North Wing",
    "FirstName": "Max",
    "Gender": 1,
    "GeographicLocation.Code": "GL-DE-BY",
    "GeographicLocation.Description": "Germany / Bavaria",
    "HealthCenter.Code": "HC01",
    "HealthCenter.Description": "Health Center Munich",
    "HealthInsurance.Code": "HI-AOK",
    "HealthInsurance.Description": "AOK Bayern",
    "HipaaAuth": true,
    "HipaaAuthDate": "2020-01-15",
    "HomeCity": "Moosburg",
    "HomeCountry.Code": "DE",
    "HomeCountry.Description": "Deutschland",
    "HomePhone": "+49-8761-12345",
    "HomeState.Code": "BY",
    "HomeState.Description": "Bayern",
    "HomeStreet1": "Hauptstraße 12",
    "HomeStreet2": "",
    "HomeZip": "85368",
    "HourlyRate": 42.5,
    "JobPosition.Code": "JP-DEV",
    "JobPosition.Description": "Software Developer",
    "JobPositionGroup.Code": "JPG-ENG",
    "JobPositionGroup.Description": "Engineering Group",
    "JobType.Code": "JT-STD",
    "JobType.Description": "Standard",
    "Language.Code": "DE",
    "Language.Description": "Deutsch",
    "LastName": "Mustermann",
    "Location.Code": "LOC-MUC",
    "Location.Description": "Munich HQ",
    "LoginId": "mmustermann",
    "MaidenName": "",
    "MailStop": "MS-01",
    "MaritalStatus.Code": "M",
    "MaritalStatus.Description": "Married",
    "MedicalInsuranceNumber": "MI-123456789",
    "MedicalRecordNumber": "MR-987654",
    "MiddleName": "",
    "MonthlyWorkHours": 160,
    "NickName": "Maxi",
    "Organization.Code": "ORG-01",
    "Organization.Description": "Corporate",
    "Pager": "",
    "Photo": null,
    "Physician": "Dr. Erika Beispiel",
    "PhysicianCity": "Freising",
    "PhysicianPhone": "+49-8161-55555",
    "PhysicianState.Code": "BY",
    "PhysicianState.Description": "Bayern",
    "PhysicianStreet": "Ärzteweg 5",
    "PhysicianZip": "85354",
    "SecondaryHealthCenter.Code": "HC02",
    "SecondaryHealthCenter.Description": "Backup Health Center",
    "SeniorityDate": "2015-03-01",
    "ShiftCode.Code": "SHIFT-A",
    "ShiftCode.Description": "Morning Shift",
    "ShiftCode.ShiftBegins": "2024-01-01",
    "ShiftCode.ShiftDuration": 8,
    "SSNValue": "123-45-6789",
    "Supervisor.EmployeeNumber": "EMP-0001",
    "UDF1": "Custom1",
    "UDF2": "Custom2",
    "UDF3": "Custom3",
    "UDF4": "Custom4",
    "UDF5": "Custom5",
    "Union.Code": "UN-01",
    "Union.Description": "General Workers Union",
    "WorkExtension": "123",
    "WorkPhone": "+49-89-111222",
    "WorkStatus.Code": "ACTIVE",
    "WorkStatus.Description": "Currently employed"
  },
  {
    "schema_version": 1,
    "Building.Code": "B-001",
    "Building.Description": "Hauptbüro",
    "CellPhone": "+49-171-5551234",
    "DateOfBirth": "1985-04-12",
    "DateOfHire": "2010-09-01",
    "DateOfTermination": null,
    "Department.Code": "DEP10",
    "Department.Description": "Ingenieurwesen",
    "Division.Code": "DIV-A",
    "Division.Description": "Produktentwicklung",
    "DriverLicenseClass": "B",
    "DriverLicenseNumber": "DLN1234567",
    "DriverLicenseState.Code": "BY",
    "DriverLicenseState.Description": "Bayern",
    "Email": "employee@example.com",
    "EmergencyContact": "Anna Musterfrau",
    "EmergencyHomePhone": "+49-89-123456",
    "EmergencyRelation": "Ehepartner",
    "EmergencyWorkPhone": "+49-89-987654",
    "EmployeeNumber": "EMP-1001",
    "EmployeeType.Code": "FULL",
    "EmployeeType.Description": "Vollzeit",
    "EthnicGroup.Code": "EG1",
    "EthnicGroup.Description": "Gruppe 1",
    "FloorArea.Code": "FA-01",
    "FloorArea.Description": "Nordflügel",
    "FirstName": "Max",
    "Gender": 1,
    "GeographicLocation.Code": "GL-DE-BY",
    "GeographicLocation.Description": "Deutschland / Bayern",
    "HealthCenter.Code": "HC01",
    "HealthCenter.Description": "Gesundheitszentrum München",
    "HealthInsurance.Code": "HI-AOK",
    "HealthInsurance.Description": "AOK Bayern",
    "HipaaAuth": true,
    "HipaaAuthDate": "2020-01-15",
    "HomeCity": "Moosburg",
    "HomeCountry.Code": "DE",
    "HomeCountry.Description": "Deutschland",
    "HomePhone": "+49-8761-12345",
    "HomeState.Code": "BY",
    "HomeState.Description": "Bayern",
    "HomeStreet1": "Hauptstraße 12",
    "HomeStreet2": "",
    "HomeZip": "85368",
    "HourlyRate": 42.5,
    "JobPosition.Code": "JP-DEV",
    "JobPosition.Description": "Softwareentwickler",
    "JobPositionGroup.Code": "JPG-ENG",
    "JobPositionGroup.Description": "Ingenieurgruppe",
    "JobType.Code": "JT-STD",
    "JobType.Description": "Standard",
    "Language.Code": "DE",
    "Language.Description": "Deutsch",
    "LastName": "Mustermann",
    "Location.Code": "LOC-MUC",
    "Location.Description": "München Zentrale",
    "LoginId": "mmustermann",
    "MaidenName": "",
    "MailStop": "MS-01",
    "MaritalStatus.Code": "M",
    "MaritalStatus.Description": "Verheiratet",
    "MedicalInsuranceNumber": "MI-123456789",
    "MedicalRecordNumber": "MR-987654",
    "MiddleName": "",
    "MonthlyWorkHours": 160,
    "NickName": "Maxi",
    "Organization.Code": "ORG-01",
    "Organization.Description": "Unternehmen",
    "Pager": "",
    "Photo": null,
    "Physician": "Dr. Erika Beispiel",
    "PhysicianCity": "Freising",
    "PhysicianPhone": "+49-8161-55555",
    "PhysicianState.Code": "BY",
    "PhysicianState.Description": "Bayern",
    "PhysicianStreet": "Ärzteweg 5",
    "PhysicianZip": "85354",
    "SecondaryHealthCenter.Code": "HC02",
    "SecondaryHealthCenter.Description": "Ersatz-Gesundheitszentrum",
    "SeniorityDate": "2015-03-01",
    "ShiftCode.Code": "SHIFT-A",
    "ShiftCode.Description": "Frühschicht",
    "ShiftCode.ShiftBegins": "2024-01-01",
    "ShiftCode.ShiftDuration": 8,
    "SSNValue": "123-45-6789",
    "Supervisor.EmployeeNumber": "EMP-0001",
    "UDF1": "Custom1",
    "UDF2": "Custom2",
    "UDF3": "Custom3",
    "UDF4": "Custom4",
    "UDF5": "Custom5",
    "Union.Code": "UN-01",
    "Union.Description": "Allgemeine Arbeitergewerkschaft",
    "WorkExtension": "123",
    "WorkPhone": "+49-89-111222",
    "WorkStatus.Code": "ACTIVE",
    "WorkStatus.Description": "Derzeit beschäftigt"
  }
]
